{
 "$schema": "https://json-schema.org/draft/2020-12/schema",
 "additionalProperties": false,
 "properties": {
  "coverage": {
   "type": "object"
  },
  "fits": {
   "type": "object"
  },
  "generated_at": {
   "type": "string"
  },
  "intervals": {
   "additionalProperties": true,
   "properties": {
    "kind": {
     "const": "prediction"
    }
   },
   "required": [
    "kind"
   ],
   "type": "object"
  },
  "schema_version": {
   "const": "v1"
  },
  "series": {
   "type": "object"
  },
  "spec": {
   "type": "object"
  },
  "tags": {
   "additionalProperties": {
    "pattern": "^(OBSERVED|DERIVED|PREDICTED|SIMULATED|SYNTHETIC)(/(OBSERVED|DERIVED|PREDICTED|SIMULATED|SYNTHETIC))*$",
    "type": "string"
   },
   "minProperties": 1,
   "type": "object"
  },
  "tolerance": {
   "additionalProperties": false,
   "properties": {
    "abs": {
     "type": "number"
    },
    "note": {
     "type": "string"
    },
    "rel": {
     "type": "number"
    }
   },
   "required": [
    "abs",
    "rel",
    "note"
   ],
   "type": "object"
  },
  "vectors": {
   "items": {
    "type": "object"
   },
   "minItems": 3,
   "type": "array"
  }
 },
 "required": [
  "schema_version",
  "generated_at",
  "tags",
  "spec",
  "series",
  "fits",
  "intervals",
  "coverage",
  "vectors",
  "tolerance"
 ],
 "title": "Forecast intervals",
 "type": "object"
}
