{"coverage":{"ar1":{"0.8":[0.771,0.773,0.778,0.767,0.772,0.759,0.7765,0.768,0.7835,0.756,0.7655,0.7785],"0.95":[0.945,0.942,0.937,0.933,0.928,0.925,0.934,0.931,0.9275,0.916,0.9375,0.9375]},"horizons":[1,2,3,4,5,6,7,8,9,10,11,12],"nominal":[0.8,0.95],"reps":2000,"ses":{"0.8":[0.785,0.78,0.797,0.801,0.835,0.854,0.8705,0.896,0.9045,0.912,0.9325,0.9375],"0.95":[0.9385,0.938,0.9555,0.95,0.963,0.974,0.977,0.983,0.984,0.988,0.9925,0.993]}},"fits":{"ar1":{"c":23.158217165164785,"last":116.63377301007036,"mu":101.56773253085004,"phi":0.7719923780110899,"sigma2":29.57110981732288},"ses":{"alpha":0.83,"level":115.38448648127637,"sigma2":31.80684584631327,"sse":3403.3325055555197}},"generated_at":"2026-10-11T00:00:00Z","intervals":{"ar1":{"0.8":[[113.19860095,106.22961005,120.16759185],[110.5466743,101.74262303,119.35072557],[108.49940714,98.76485898,118.23395529],[106.91893249,96.66993187,117.16793312],[105.69881812,95.15514904,116.24248719],[104.75689912,94.04146884,115.47232939],[104.02974483,93.21324671,114.84624295],[103.46838726,92.59210215,114.34467237],[103.03502349,92.12326278,113.9467842],[102.70046997,91.76762154,113.6333184],[102.4421972,91.49680039,113.38759401],[102.24281259,91.28994413,113.19568105]],"0.95":[[113.19860095,102.54044911,123.85675279],[110.5466743,97.08203981,124.01130878],[108.49940714,93.61170047,123.38711381],[106.91893249,91.24443867,122.59342632],[105.69881812,89.57366778,121.82396845],[104.75689912,88.3690627,121.14473553],[104.02974483,87.48733848,120.57215118],[103.46838726,86.8345446,120.10222992],[103.03502349,86.34692559,119.7231214],[102.70046997,85.98012117,119.42081877],[102.4421972,85.70265731,119.18173709],[102.24281259,85.49184581,118.99377937]]},"holdout":[113.839119,116.636864,106.362813,110.404561,117.215729,115.857264,114.851351,113.073321,111.448844,118.917567,111.846219,109.532425],"kind":"prediction","ses":{"0.8":[[115.38448648,108.15684857,122.6121244],[115.38448648,105.99161554,124.77735743],[115.38448648,104.23938445,126.52958852],[115.38448648,102.72744993,128.04152303],[115.38448648,101.3777792,129.39119376],[115.38448648,100.14719264,130.62178033],[115.38448648,99.00882166,131.76015131],[115.38448648,97.94459906,132.8243739],[115.38448648,96.94168442,133.82728855],[115.38448648,95.99056417,134.7784088],[115.38448648,95.08395699,135.68501597],[115.38448648,94.21614285,136.55283012]],"0.95":[[115.38448648,104.33076817,126.43820479],[115.38448648,101.01933001,129.74964295],[115.38448648,98.33952381,132.42944915],[115.38448648,96.02721952,134.74175345],[115.38448648,93.96307625,136.80589671],[115.38448648,92.08105652,138.68791645],[115.38448648,90.34006834,140.42890462],[115.38448648,88.71248033,142.05649263],[115.38448648,87.17865474,143.59031822],[115.38448648,85.72404185,145.04493112],[115.38448648,84.33750583,146.43146714],[115.38448648,83.01029862,147.75867434]]}},"schema_version":"v1","series":{"mu":100.0,"n_train":108,"phi":0.7,"seed":20261011,"sigma":5.0,"x":[86.743703,91.778081,93.149595,94.662775,95.543801,91.912057,87.444259,99.559714,99.364228,106.69078,113.782404,115.196047,114.046001,104.663115,110.195262,103.488346,101.716958,107.497456,100.593307,93.056469,97.082342,97.999982,93.33502,96.110645,86.911414,87.569161,97.523473,97.027833,93.352761,104.685472,105.360365,111.775248,103.353974,100.296055,103.517511,115.987525,105.9532,115.752347,113.344063,114.144008,108.561176,111.115442,107.531966,104.574204,110.206448,104.820035,100.931773,99.369572,96.264842,94.833462,85.465761,93.027067,90.508313,95.932293,99.127882,92.508795,94.851791,101.920998,108.888194,110.130834,104.394494,98.816805,94.133328,89.850597,86.550785,73.534463,87.022987,83.13168,92.359112,88.273264,95.145336,97.877494,100.324976,111.66722,109.805124,112.263781,116.534818,104.326121,105.505576,101.695847,107.653115,107.408648,101.100547,93.43358,97.32554,94.162379,93.215495,95.35019,94.505035,96.020393,102.327853,92.772044,92.406978,94.493313,101.482789,106.392935,104.908295,99.038735,96.800226,98.654792,103.944513,109.197007,110.063779,108.240189,104.291201,105.423483,110.090491,116.633773,113.839119,116.636864,106.362813,110.404561,117.215729,115.857264,114.851351,113.073321,111.448844,118.917567,111.846219,109.532425]},"spec":{"coverage_study":"2000 replicate series (numpy PCG64, seed 20261011), n=120 train, horizons 1..12; precomputed, NOT reproduced by the browser","labels":{"prediction":"A prediction interval is the range in which one single future observation is expected to fall with the stated probability, if the model is right; it is wider than a confidence interval for a mean and is not a credible interval."},"models":"analytics/forecast.py docstring","reading":"SES ignores mean reversion so its long-horizon bands are mis-sized; the study reports that rather than hiding it","truth":{"mu":100.0,"phi":0.7,"sigma":5.0}},"tags":{"coverage":"SIMULATED","fits":"PREDICTED","intervals":"PREDICTED","series":"SYNTHETIC","vectors":"SYNTHETIC"},"tolerance":{"abs":1e-07,"note":"pass when |got - want| <= abs + rel*|want|","rel":1e-08},"vectors":[{"ar1":{"c":31.07078867,"mu":50.69266662,"phi":0.38707528,"sigma2":4.19112513},"forecast_ar1":{"0.8":[[51.71264513,49.08902231,54.33626795],[51.08747509,48.27416436,53.90078581],[50.84548722,48.00484694,53.68612749],[50.7518197,47.90710733,53.59653206],[50.71556331,47.87024134,53.56088529],[50.70152937,47.85611606,53.54694267],[50.69609717,47.85067019,53.54152416],[50.6939945,47.84856547,53.53942354],[50.69318061,47.84775127,53.53860995],[50.69286557,47.84743619,53.53829496],[50.69274363,47.84731424,53.53817303],[50.69269643,47.84726703,53.53812583]],"0.95":[[51.71264513,47.70016029,55.72512997],[51.08747509,46.78488763,55.39006254],[50.84548722,46.50110282,55.18987162],[50.7518197,46.40120756,55.10243183],[50.71556331,46.36401887,55.06710776],[50.70152937,46.34984525,55.05321348],[50.69609717,46.34439213,55.04780221],[50.6939945,46.34228632,55.04570268],[50.69318061,46.34147196,55.04488926],[50.69286557,46.34115686,55.04457429],[50.69274363,46.3410349,55.04445236],[50.69269643,46.3409877,55.04440516]]},"forecast_ses":{"0.8":[[50.53810803,47.66855331,53.40766275],[50.53810803,47.66726231,53.40895376],[50.53810803,47.66597188,53.41024419],[50.53810803,47.66468203,53.41153404],[50.53810803,47.66339276,53.41282331],[50.53810803,47.66210406,53.414112],[50.53810803,47.66081595,53.41540012],[50.53810803,47.65952841,53.41668766],[50.53810803,47.65824145,53.41797462],[50.53810803,47.65695506,53.41926101],[50.53810803,47.65566924,53.42054682],[50.53810803,47.654384,53.42183206]],"0.95":[[50.53810803,46.14950281,54.92671326],[50.53810803,46.14752838,54.92868769],[50.53810803,46.14555484,54.93066123],[50.53810803,46.14358218,54.93263388],[50.53810803,46.14161041,54.93460565],[50.53810803,46.13963953,54.93657654],[50.53810803,46.13766952,54.93854654],[50.53810803,46.1357004,54.94051566],[50.53810803,46.13373216,54.9424839],[50.53810803,46.1317648,54.94445126],[50.53810803,46.12979832,54.94641775],[50.53810803,46.12783271,54.94838336]]},"mu":50.0,"n":60,"phi":0.5,"seed":11,"ses":{"alpha":0.03,"level":50.53810803,"sigma2":5.01368276,"sse":295.80728257},"sigma":2.0,"x_last_3":[51.4280901454,50.5145578173,53.3277574479]},{"ar1":{"c":21.15243027,"mu":102.64137654,"phi":0.79391907,"sigma2":29.00706574},"forecast_ar1":{"0.8":[[108.11231099,101.21010391,115.01451807],[106.98485573,98.17187649,115.79783497],[106.0897475,96.26144323,115.91805178],[105.37910401,94.96155292,115.7966551],[104.81491059,94.04250061,115.58732057],[104.36698667,93.37679196,115.35718139],[104.01137133,92.88609551,115.13664715],[103.72904153,92.51945941,114.93862365],[103.50489452,92.24249775,114.76729129],[103.32693993,92.03138057,114.62249929],[103.18565839,91.86924633,114.50207045],[103.07349228,91.74395633,114.40302823]],"0.95":[[108.11231099,97.55629619,118.66832579],[106.98485573,93.5065671,120.46314437],[106.0897475,91.05865322,121.12084179],[105.37910401,89.44683449,121.31137353],[104.81491059,88.33993123,121.28988994],[104.36698667,87.5589343,121.17503904],[104.01137133,86.99673024,121.02601242],[103.72904153,86.58546508,120.87261798],[103.50489452,86.28054503,120.729244],[103.32693993,86.05187264,120.60200722],[103.18565839,85.87869965,120.49261713],[103.07349228,85.74646228,120.40052228]]},"forecast_ses":{"0.8":[[110.17869767,103.06166158,117.29573376],[110.17869767,101.01981603,119.33757931],[110.17869767,99.3565896,121.00080575],[110.17869767,97.91693053,122.44046481],[110.17869767,96.62938612,123.72800923],[110.17869767,95.4539989,124.90339644],[110.17869767,94.36573894,125.99165641],[110.17869767,93.34769728,127.00969806],[110.17869767,92.38781561,127.96957973],[110.17869767,91.47713638,128.88025896],[110.17869767,90.60878953,129.74860582],[110.17869767,89.77736891,130.58002643]],"0.95":[[110.17869767,99.29413025,121.06326509],[110.17869767,96.17139696,124.18599839],[110.17869767,93.62771164,126.7296837],[110.17869767,91.4259431,128.93145224],[110.17869767,89.45681384,130.9005815],[110.17869767,87.65921422,132.69818112],[110.17869767,85.99486423,134.36253112],[110.17869767,84.43790387,135.91949147],[110.17869767,82.96989154,137.3875038],[110.17869767,81.57712785,138.78026749],[110.17869767,80.24910593,140.10828941],[110.17869767,78.97755784,141.37983751]]},"mu":100.0,"n":120,"phi":0.7,"seed":20261011,"ses":{"alpha":0.81,"level":110.17869767,"sigma2":30.84083767,"sse":3670.05968292},"sigma":5.0,"x_last_3":[118.9175666885,111.8462189177,109.5324245748]},{"ar1":{"c":1.91897754,"mu":10.02008791,"phi":0.80848696,"sigma2":0.8662592},"forecast_ar1":{"0.8":[[12.14666641,10.95388732,13.33944549],[11.73939889,10.20555216,13.27324562],[11.41012841,9.68950127,13.13075554],[11.14391752,9.31146181,12.97637324],[10.92868949,9.02668707,12.83069191],[10.75468044,8.80856148,12.7007994],[10.61399639,8.63957328,12.5884195],[10.50025517,8.50754828,12.49296205],[10.40829688,8.40372891,12.41286484],[10.3339498,8.3216666,12.34623299],[10.27384115,8.25653084,12.29115146],[10.2252441,8.20465456,12.24583363]